{"as_of_date":"2026-08-13","assessments":[{"assessment_date":"2026-08-13","confirmation_state":"candidate_confirmed","relation":"knowledge_gap","signal":"terraform"}],"draft_only":true,"locale":"en","no_external_action":true,"privacy_boundary":"identity_free_closed_candidate_assessment_only","schema_version":"candidate-gap-assessment-v1","selected_provider_option_id":"LP-003","selected_signal":"terraform","selected_vacancy_id":"V-003","source_dossier_snapshot":"snap-dossier-sha256-4421cc64f2bca782e998ab2f9488be928bf4f27a0e9bb9a706e0abdde0485b03","source_gap_response_snapshot":"snap-gap-response-v1-sha256-80b6789e8877515de1d023f81cdf214bda34efeee6ef687757ca78737b054d74","source_market_snapshot":"snap-market-dossier-v2-sha256-e6481fc131e14bd995628acc38e7b0dc5badb13b9d7c405ca5a01ecdfee7df4e","source_provider_research_snapshot":"snap-provider-sha256-1a47017cdf515c2471fa476fedbfa67ca1a9eaf4ff19d8283cd604aa1bf73a31","source_research_snapshot":"snap-market-sha256-018be6ecf73ffb038a260b4c09cdbfa9b6c083a5e42dd06679b80f814b785183","state":"complete"}
