{"as_of_date":"2026-08-13","assessments":[{"assessment_date":"2026-08-13","confirmation_state":"candidate_confirmed","relation":"proof_gap","signal":"terraform"}],"draft_only":true,"locale":"es","no_external_action":true,"privacy_boundary":"identity_free_closed_candidate_assessment_only","schema_version":"candidate-gap-assessment-v1","selected_provider_option_id":null,"selected_signal":"terraform","selected_vacancy_id":"V-003","source_dossier_snapshot":"snap-dossier-sha256-1cc5d236dc6a805748612a7765895e94adb4c3250d325239a4a398797fdc18a1","source_gap_response_snapshot":"snap-gap-response-v1-sha256-5ddfd14cfe8e557c29a76bb458aecb8e164aca156e57ec549069e49e6b82e30f","source_market_snapshot":"snap-market-dossier-v2-sha256-170c3b21b6d2343a35011f7b4bac3f24c8d22a0bf7d3847a300bb14bf8191487","source_provider_research_snapshot":null,"source_research_snapshot":"snap-market-sha256-8273d3c23da3158584005569e48be00cb1a380c4d6d6d15b2c4f8d8464ffb924","state":"complete"}
