{"as_of_date":"2026-08-13","assessments":[],"draft_only":true,"locale":"es","no_external_action":true,"privacy_boundary":"identity_free_closed_candidate_assessment_only","schema_version":"candidate-gap-assessment-v1","selected_provider_option_id":null,"selected_signal":null,"selected_vacancy_id":null,"source_dossier_snapshot":"snap-dossier-sha256-1cc5d236dc6a805748612a7765895e94adb4c3250d325239a4a398797fdc18a1","source_gap_response_snapshot":"snap-gap-response-v1-sha256-1bcdf9749cee5f1805380aa6b7a436c4412567e013d4f50d20f2ca002bc51535","source_market_snapshot":"snap-market-dossier-v2-sha256-170c3b21b6d2343a35011f7b4bac3f24c8d22a0bf7d3847a300bb14bf8191487","source_provider_research_snapshot":null,"source_research_snapshot":"snap-market-sha256-8273d3c23da3158584005569e48be00cb1a380c4d6d6d15b2c4f8d8464ffb924","state":"selection_required"}
