{"as_of_date":"2026-08-13","assessments":[],"draft_only":true,"locale":"es","no_external_action":true,"privacy_boundary":"identity_free_closed_candidate_assessment_only","schema_version":"candidate-gap-assessment-v1","selected_provider_option_id":null,"selected_signal":null,"selected_vacancy_id":null,"source_dossier_snapshot":"snap-dossier-sha256-1cc5d236dc6a805748612a7765895e94adb4c3250d325239a4a398797fdc18a1","source_gap_response_snapshot":"snap-gap-response-v1-sha256-cb2cbf8146ab1aaabf02996a4e2e91cd1511ee9899cb720d895b23460a4e9f18","source_market_snapshot":"snap-market-dossier-v2-sha256-b8a6838f7259b16c265174d6da2f8d3da7f16df5d510098451233e436c0982bf","source_provider_research_snapshot":null,"source_research_snapshot":"snap-market-sha256-c7b20fd2df65c1ff2861b1db899e661142ea641bd5c270889883fdedac5f22ce","state":"unavailable"}
